Sentence,translated_text
"Interactive design requires that components of a project connect to each other, but also make sense as a separate entity.","Thiết kế tương tác người dùng đòi hỏi các yếu tố của một dự án phải liên kết với nhau, và cũng phải có ý nghĩa khi đứng một mình."
Increasingly supermarkets are getting a more varied section of ready-made food. Some even provide a microwave oven or other means to heat food.,Các siêu thị đang dần có thêm nhiều phần thực phẩm đã chế biến sẵn phong phú hơn. Một số siêu thị thậm chí còn cung cấp lò vi sóng hoặc các thiết bị hỗ trợ khác để hâm nóng thức ăn.
An official with the gas company was reporting to the scene after a neighbor called about a gas leak.,Một nhân viên công ty khí đốt đã đến hiện trường sau khi nhận được cuộc gọi từ một người hàng xóm về việc rò rỉ khí đốt.
"At least 100 people had attended the party, in order to celebrate the first anniversary of a couple whose wedding was held last year.",Ít nhất 100 người đã tham dự đám tiệc để kỷ niệm ngày cưới đầu tiên của đôi vợ chồng đã cưới vào năm ngoái.
"The Cook Islands are an island country in free association with New Zealand, located in Polynesia, in the middle of the South Pacific Ocean.","Quần đảo Cook là một quốc gia quần đảo nằm trong liên kết tự do với New Zealand, thuộc vùng Polynesia, nằm ở trung tâm của Thái Bình Dương phía Nam."
"Cells are so basic and critical to the study of life, in fact, that they are often referred to as ""the building blocks of life"".","Tế bào rất cơ bản và quan trọng đến mức trong nghiên cứu về sự sống, thực tế là chúng thường được gọi là ""các đơn vị cấu tạo của sự sống""."
Real-time text translator apps – applications that are capable of automatically translating whole segments of text from one language into another.,Ứng dụng dịch văn bản tức thời – cho phép dịch tự động toàn bộ đoạn văn giữa các ngôn ngữ.
"General John Cadwalder would launch a diversionary attack against the British garrison at Bordentown, in order to block off any reinforcements.",Tướng John Cadwalader sẽ phát động một cuộc tấn công nghi binh vào đồn trú của người Anh tại Bordentown nhằm chặn đứng bất kỳ lực lượng tăng援 nào.
The Drukgyal Dzong is a ruined fortress and Buddhist monastery in the upper part of the Paro District (in Phondey Village).,Drukgyal Dzong là một lâu đài và chùa Phật giáo tàn tích nằm ở phía trên của huyện Paro (thuộc làng Phondey).
Visa requirements and costs vary from nation to nation and are affected by the country you come from.,Yêu cầu và lệ phí thị thực khác nhau tùy theo quốc gia và phụ thuộc vào quốc gia bạn đến từ đi.
"For most countries, you will need an offer letter from the institution you wish to study at, and also evidence of funds to support yourself for at least the first year of your course.","Ở hầu hết các quốc gia, bạn sẽ cần một thư chấp nhận từ trường đại học bạn muốn học và cũng phải có bằng chứng về khả năng tài chính để chi trả cho bản thân trong năm học đầu tiên."
"In this resonance, magnetic field and radio waves cause atoms to give off tiny radio signals.","Trong hiện tượng cộng hưởng này, từ trường và sóng điện từ khiến nguyên tử phát xạ các tín hiệu vô tuyến rất nhỏ."
"Thus the scourges of Delhi Belly, the Pharaoh's Curse, Montezuma's Revenge, and their many friends.","Do đó, những điều khủng khiếp của Bệnh tiêu chảy Delhi, Lời nguyền của các Pharaoh, Bệnh tiêu chảy của Montezuma, và nhiều điều khủng khiếp khác."
"It has the same molecular structure whether it is a gas, liquid, or solid.","Nó có cấu trúc phân tử giống nhau dù ở thể khí, lỏng hoặc rắn."
A couple of thousand staff live here in summer in some four dozen bases mostly in those areas; a small number stay over winter.,"Hàng nghìn nhân viên sinh sống tại đây vào mùa hè trong gần bốn chục căn cứ, chủ yếu tập trung ở những khu vực đó; một số ít ở lại suốt mùa đông."
"The band's management company, HK Management Inc., gave no initial reason when they canceled on September 20, but blamed logistical reasons by the next day.","Công ty quản lý của ban nhạc, HK Management Inc., không đưa ra lý do cụ thể khi họ hủy bỏ vào ngày 20 tháng 9, nhưng trình bày lý do về mặt hậu cần ngày hôm sau."
"Although most agencies are willing to take on most regular bookings, many agents specialise in particular types of travel, budget ranges or destinations.","Hầu hết các cơ quan đều sẵn sàng chấp nhận hầu hết các đặt chỗ thường xuyên, tuy nhiên nhiều đại lý lại chuyên về các lĩnh vực du lịch cụ thể, khoảng ngân sách hoặc điểm đến nhất định."
Its large glazed windows and thin walls would not have been able to resist a determined attack for long.,Cửa sổ kính lớn và tường mỏng sẽ không thể chịu đựng một cuộc tấn công dứt khoát trong thời gian dài nữa.
However in 991 Ethelred was faced with a Viking fleet larger than any since Guthrum's a century earlier.,Tuy thế vào năm 991 Ethelred đối mặt với một hạm đội người Viking lớn nhất kể từ thời Guthrum một thế kỷ trước.
"According to reports, an apartment on Macbeth Street exploded due to a gas leak.","Theo tin tức, một chung cư trên đường Macbeth bị nổ do rò rỉ khí ga."
When all individuals in a population are identical with regard to a particular phenotypic trait they are known as monomorphic.,Khi tất cả các cá thể trong một quần thể đều có tính trạng kiểu hình giống nhau thì quần thể đó được gọi là đồng hình.
"The outer-part we see when we look at the Sun is called the photosphere, which means ""ball of light"".","Phần ngoài cùng mà chúng ta nhìn thấy khi nhìn vào Mặt Trời được gọi là quang cầu, tạm dịch là vùng sáng."
"The pattern should be deep enough, 5 mm (1/5 inch) or more, and the material soft enough in cold temperatures.","Mẫu nên có độ sâu khoảng 5 mm (1/5 inch) hoặc sâu hơn, và vật liệu mềm vừa phải khi trời lạnh."
"For those unfamiliar with medical jargon, the words infectious and contagious have distinct meanings.","Với những người không quen thuộc với ngôn ngữ y khoa, nhiễm trùng và lây lan có ý nghĩa khác nhau."
"Avalanches are not an abnormality; steep slopes can hold only so much slow, and the excess volumes will come down as avalanches.","Lở tuyết không phải là điều bất thường; sườn dốc đứng chỉ có thể chứa một lượng tuyết nhất định, và lượng tuyết dư thừa sẽ trượt xuống dưới dạng lở tuyết."
"These bosses had been reined in by Provenzano when he put an end to the Riina-driven war against the state that claimed the lives of Mafia crusaders Giovanni Falcone and Paolo Borsellino in 1992.""","Những ông trùm này đã bị Provenzano kiềm chế khi ông ấy kết thúc cuộc chiến do Riina lãnh đạo, đã cướp đi sinh mạng của những người chống Mafia Giovanni Falcone và Paolo Borsellino vào năm 1992."
"Accompanied by those officials, he assured Texas citizens that steps were being taken to protect the public's safety.","Cùng với những quan chức đó, ông đảm bảo với người dân Texas rằng đang thực hiện các biện pháp để đảm bảo an toàn cho công chúng."
The building housed a number of pilgrims who came to visit the holy city at the eve of hajj pilgrimage.,Toà nhà này chứa một số những người hành hương đến thăm thành thánh vào dịp chuẩn bị cho lễ Hajj.
"Nevertheless, there are many distinctive ways of drinking coffee around the world that are worth experiencing.","Tuy nhiên, trên khắp thế giới có rất nhiều cách uống cà phê độc đáo đáng để trải nghiệm."
"Already reporting in English and Japanese, the global organization is launching Spanish, Italian, and Korean-language programs, for television, the web, and mobile devices.","Đã phát sóng bằng tiếng Anh và tiếng Nhật, tổ chức quốc tế đang khởi động các chương trình bằng tiếng Tây Ban Nha, tiếng Italia và tiếng Hàn Quốc, trên truyền hình, internet và thiết bị di động."
A cell is the smallest structural and functional unit of a living (things) organism.,"Tế bào là đơn vị cơ bản nhất của một sinh vật còn sống, nơi thực hiện các chức năng và cấu trúc cần thiết cho sự sống."
"During the last three decades, despite officially remaining a communist state, China has developed a market economy.","Trong ba thập niên vừa qua, mặc dù vẫn mang danh nghĩa là một quốc gia cộng sản, Trung Quốc đã xây dựng và phát triển một nền kinh tế thị trường."
"The focus of this mindset is speed, logic and accuracy, also identification of facts, reapplying existing techniques, gathering information.","Điểm then chốt của cách suy nghĩ này là tốc độ, lô-gic và chính xác, cũng như xác định sự kiện, vận dụng các kỹ thuật đã có và thu thập, xử lý thông tin."
"When low tide opened a gap along the Mystic River along the northeast of the peninsula, they quickly extended the fence with a short stone wall to the north ending at the water's edge on a small beach.","Khi thủy triều xuống thấp, một khoảng trống được mở ra dọc theo bờ sông Mystic ở phía đông bắc của bán đảo, họ nhanh chóng kéo dài hàng rào và xây thêm một đoạn tường đá ngắn về phía bắc, kết thúc tại bờ nước của một bãi biển nhỏ."
"In this instance, recalling previous instances of entrepreneurial behavior and resulting successes helped people to be open to new changes and new direction for the local church.","Lần này, nhớ lại những lần thể hiện tinh thần doanh nhân trước đây và kết quả thành công đã giúp mọi người sẵn sàng đón nhận những thay đổi mới và hướng đi mới cho giáo xứ địa phương."
"Jerusalem is the capital and largest city of Israel, though most other countries and the United Nations do not recognize it as Israel's capital.","Giê-ru-sa-lem là thành phố lớn nhất của Israel, nhưng không được công nhận là thủ đô chính thức của nước này bởi các quốc gia khác hầu hết và LHQ."
"Seven points behind, Johnson is second with 2,243.","Johnson thua kém 7 điểm, xếp thứ hai với tổng điểm 2.243."
"""Apart from the fever and a sore throat, I feel well and in good shape to carry out my work by telecommuting.","Ngoài sốt và đau họng, tôi cảm thấy khoẻ mạnh và đủ sức để làm việc từ xa."
"San Francisco has developed a large tourist infrastructure with numerous hotels, restaurants, and top-notch convention facilities.","Thành phố San Francisco phát triển mạnh mẽ về du lịch với nhiều khách sạn, nhà hàng và trung tâm hội nghị hiện đại."
"If you look at living things under a microscope, you will see that they are made of small squares or balls.","Nếu bạn quan sát các sinh vật dưới kính hiển vi, bạn sẽ thấy rằng chúng được cấu tạo từ các đơn vị cơ bản có hình dạng là các khối vuông nhỏ hoặc các quả cầu."
"Written words are often easier to understand than spoken words, also. This is especially true of addresses, which are often difficult to pronounce intelligibly.","Từ viết thường dễ hiểu hơn từ nói, cũng thế, đặc biệt là với địa chỉ, thường khó phát âm rõ ràng."
"Then, a few years later in 1639, an English astronomer named Jeremiah Horrocks observed a transit of Venus.","Tiếp theo, một vài năm sau đó vào năm 1639, một nhà thiên văn người Anh tên là Jeremiah Horrocks đã theo dõi sao Kim băng qua Mặt Trời."
"Unless you are a diplomat, working overseas generally means that you will have to file income tax in the country you are based in.","Nếu bạn không phải là nhà ngoại giao, làm việc ở nước ngoài thường dẫn đến việc bạn sẽ phải kê khai và nộp thuế thu nhập ở quốc gia nơi bạn đang làm việc."
"However, Charles went to university at Trinity College, Cambridge where he studied Anthropology and Archaeology, and later History, earning a 2:2 (a lower second class degree).","Tuy thế, Charles đã theo học tại Trinity College, Cambridge nơi ông theo học Nhân chủng - Khảo cổ và sau đó là Lịch sử, được cấp bằng 2:2 (bằng cấp hạng nhì loại hai)."
"I expect to return to all my duties on Monday,"" Arias said in a statement.","""Tôi hy vọng sẽ trở lại thực hiện tất cả các nhiệm vụ của mình vào thứ Hai"", ông Arias cho biết trong lời phát biểu."
"What is a cell? The word cell comes from the Latin word ""cella"", meaning ""small room"", and it was first coined by a microscopist observing the structure of cork.","Tế bào là cái gì? Từ tế bào có nguồn gốc từ tiếng Latin 'cella', tương đương với 'phòng nhỏ', và được đặt ra lần đầu bởi một nhà kính hiển vi quan sát cấu trúc của gỗ sồi."
Russian ground control activated the jets and normal attitude of the station was regained.,Trạm điều khiển mặt đất của Nga đã khởi động các động cơ đẩy và trạm đã lấy lại tư thế bình thường.
"It is possible to secure park permits directly from the Ranger Station in Puerto Jiménez, but they do not accept credit cards","Có thể xin giấy phép vào vườn quốc gia trực tiếp tại Trạm Kiểm lâm tại Puerto Jimenez, nhưng họ không nhận thẻ tín dụng"
"He did, however, reiterate his earlier statement that Roe v. Wade was the ""settled law of the land"", emphasizing the importance of consistent Supreme Court rulings.","Tuy vậy, ông đã nhắc lại tuyên bố trước đó của mình rằng Roe v. Wade là luật đất đai đã được xác lập, và nhấn mạnh vào tầm quan trọng của các bản án nhất quán của Tòa án Tối cao."
"Especially in your initial days, consider splurging on Western-style and -quality hotels, food, and services to help acclimatize.","Đặc biệt là trong những ngày đầu đến, hãy cân nhắc chi tiêu cho khách sạn, nhà hàng và dịch vụ theo phong cách và chất lượng của phương Tây để giúp bạn thích nghi."
"MRI is based on a physics phenomenon called nuclear magnetic resonance (NMR), which was discovered in the 1930s by Felix Bloch (working at Stanford University) and Edward Purcell (from Harvard University).","Cảnh báo MRI dựa trên một hiện tượng vật lý học gọi là cộng hưởng từ nhân, được phát hiện vào những năm 1930 bởi Felix Bloch (khi đó đang làm việc tại Đại học Stanford) và cùng với Edward Purcell (từ Đại học Harvard)."
"In an ambush east of Bardia, the British captured the Italian Tenth Army's Engineer-in-Chief, General Lastucci.","Trong một cuộc phục kích ở phía đông thành phố Bardia, quân đội Anh đã bắt giữ Tư lệnh kỹ thuật của Quân đoàn 10 Ý, Đại tướng Lastucci."
"Wildlife is among the most challenging motifs for a photographer, and needs a combination of good luck, patience, experience and good equipment.","Thiên nhiên hoang dã là một trong những món khó nhằn nhất đối với một nhiếp ảnh gia, và cần sự kết hợp giữa may mắn, sự kiên nhẫn, kinh nghiệm và thiết bị chất lượng cao."
Today's Player of the Day is Alex Ovechkin of the Washington Capitals.,"Cầu thủ của ngày hôm nay là Alex Ovechkin, đội trưởng của đội Washington Capitals."
The jail became notorious after prisoner abuse was discovered there after US forces took over.,Trại giam trở nên nổi tiếng về sự tàn ác sau khi bị phát hiện hành hạ tù nhân sau khi Mỹ tiếp quản.
"Born in the Croatian capital, Zagreb, Bobek gained fame while playing for Partizan Belgrade.","Sinh ra tại Zagreb, thủ đô của Croatia, Bobek trở nên nổi tiếng khi thi đấu cho Partizan Belgrade."
"Around 11:29, the protest moved up Whitehall, past Trafalgar Square, along the Strand, passing by Aldwych and up Kingsway towards Holborn where the Conservative Party were holding their Spring Forum in the Grand Connaught Rooms hotel.","Vào khoảng 11 giờ 29 phút, cuộc biểu tình di chuyển dọc theo Whitehall, qua Quảng trường Trafalgar, dọc theo Strand, đi qua Aldwych và lên Kingsway hướng tới Holborn nơi Đảng Bảo thủ đang tổ chức Diễn đàn Mùa xuân của họ tại khách sạn Grand Connaught Rooms."
"The Colonists, seeing this activity, had also called for reinforcements.",Các nhà thực dân nhìn thấy hoạt động này cũng đã yêu cầu tăng viện.
Stark's men took positions along the fence on the north end of the Colonist's position.,Những người dưới quyền Stark đã chiếm lĩnh dọc theo hàng rào ở đầu phía bắc của vị trí của người định cư.
It is an archipelago with 15 islands spread out over 2.2 million km2 of ocean.,"Đây là quần đảo gồm 15 hòn đảo trải rộng trên 2,2 triệu kilômét vuông biển."
"Peter Costello, Australian treasurer and the man most likely to succeed Prime Minister John Howard as Liberal party leader has thrown his support behind a nuclear power industry in Australia.","Peter Costello, bộ trưởng ngân khố Úc và người có nhiều khả năng nhất sẽ thay thế thủ tướng John Howard lãnh đạo đảng Tự do, đã tuyên bố ủng hộ ngành công nghiệp điện hạt nhân ở Úc."
"However, in Malaysia, at least among the Malays in rural areas, it means ""come over,"" similar to the index finger bent toward the body, a gesture which is used in certain Western countries, and should be used only for that purpose.","Tuy nhiên, ở Malaysia, ít nhất trong cộng đồng người Mã Lai ở khu vực nông thôn, cử chỉ này có nghĩa là 'đến đây', tương tự như khi cong ngón trỏ về phía người, một cử chỉ được sử dụng ở một số nước phương Tây và chỉ nên dùng cho mục đích đó."
"If you are going to camp out, bring a camp cot or hammock to keep you away from snakes, scorpions and such.","Nếu đi cắm trại, bạn nên mang theo chiếc giường gấp hoặc võng treo để tránh rắn, bọ cạp và các loài động vật nguy hiểm khác."
"The approach to obtaining information was different. No longer did pressure reside within individual recall, but the ability to recall text became more of a focus.","Cách thức thu thập thông tin đã thay đổi. Trước đây, áp lực nằm trong khả năng nhớ lại của từng cá nhân, nhưng giờ đây khả năng nhớ lại văn bản trở thành trọng tâm."
"Towering above the north end of Machu Picchu is this steep mountain, often the backdrop to many photos of the ruins.","Núi dốc này nằm phía trên phía bắc Machu Picchu, thường được sử dụng làm phông nền cho nhiều bức ảnh của tàn tích."
A Triceratops could have used its strong beak to strip off the leaves before eating the trunk.,Triceratops có thể đã dùng mỏ khỏe của nó để bóc lá trước khi ăn phần thân.
It can be customized to make it easy to read and also with as much or little color as desired.,Nó có thể được thiết lập để đọc dễ dàng và cũng có thể chọn màu sắc nhiều hoặc ít theo ý muốn.
"This authentic community is located in Howe Sound just off Vancouver, and is easily accessed via scheduled water taxis departing Granville Island in downtown Vancouver.","Cộng đồng truyền thống này nằm ở Howe Sound, gần bên ngoài Vancouver, và dễ dàng tiếp cận thông qua các chuyến taxi đường thủy thường xuyên khởi hành từ đảo Granville tại trung tâm thành phố Vancouver."
"There were no heavy traffic delays reported on the beltway, the city's alternate route.","Không có báo cáo về tình trạng giao thông ùn tắc trên đường cao tốc vành đai, tuyến đường vòng của thành phố."
These requirements may often depend on what countries a traveller has visited or intends to visit.,Những yêu cầu dưới đây có thể phụ thuộc vào nước mà du khách đã đến hoặc sắp đến.
"The Il-76 has been a major component of both the Russian and Soviet military since the 1970s, and had already seen a serious accident in Russia last month.","Il-76 đã trở thành một thành phần quan trọng của quân đội Nga và Liên Xô từ những năm 1970, và đã từng chứng kiến một vụ tai nạn nghiêm trọng tại Nga vào tháng trước."
"When the capsule gets to Earth and enters the atmosphere, at about 5am (eastern time), it is expected to put on quite a light show for folks in Northern California, Oregon, Nevada, and Utah.","Khi tàu vũ trụ trở về Trái Đất và đi vào bầu khí quyển Trái Đất, vào khoảng 5h sáng (giờ miền đông), dự kiến nó sẽ tạo ra một màn trình diễn ánh sáng ngoạn mục cho người dân ở khu vực Bắc California, Oregon, Nevada và Utah."
"Your hotel or hosts (if staying in a guesthouse or private home) will likely have wifi or an internet connected PC, and all settlements have an internet cafe or some location with public wifi.","Khách sạn hoặc người chủ nơi bạn ở hầu như chắc chắn có wifi hoặc máy tính có kết nối internet, và tất cả các nơi đều có quán cà phê có internet hoặc một số nơi có wifi công cộng."
"One of the world's richest people, Allen has reportedly invested much of his wealth in marine exploration and began his quest to find the Musashi out of a lifelong interest in the war.","Một trong những người giàu nhất thế giới, Allen đã đầu tư nhiều tài sản của mình vào việc nghiên cứu biển và bắt đầu tìm kiếm Musashi từ sự quan tâm của ông đối với chiến tranh suốt đời."
The main reason for this phenomenon is the result of the lucid dreams expanding the length of time between REM states.,"Lý do chính của hiện tượng này là do sự mở rộng của những giấc mơ sáng suốt, kéo dài khoảng thời gian giữa các chu kỳ REM."
"Because calls are routed over the Internet, you do not need to use a phone company located where you live or where you travel.","Vì cuộc gọi được thực hiện trên Internet, bạn không cần dịch vụ điện thoại tại nơi bạn sống hoặc nơi bạn đi du lịch."
Each show would also provide recommendations for books that children should look for when they went to their library.,Mỗi chương trình cũng sẽ gợi ý sách mà trẻ em nên đọc khi đến thư viện.
Be sure the agent through whom you book is a Galapagos specialist with a good knowledge of a wide variety of ships.,Hãy chắc chắn rằng công ty du lịch mà bạn đặt chỗ là chuyên gia về Galapagos có kinh nghiệm với kiến thức sâu rộng về nhiều loại tàu.
"With fewer REMs per night, this state in which you experience actual sleep and your body recovers becomes infrequent enough to become a problem.","Khi số lần REM mỗi đêm giảm đi, trạng thái mà bạn thực sự ngủ và cơ thể bạn hồi phục trở nên hiếm gặp đến mức gây ra vấn đề."
"Nevertheless, all French-speaking Belgians and Swiss would have learned standard French in school, so they would be able to understand you even if you used the standard French numbering system.","Dù vậy, tất cả người Bỉ và Thụy Sĩ sử dụng tiếng Pháp đều đã được đào tạo về tiếng Pháp tiêu chuẩn ở trường, nên họ vẫn có thể hiểu bạn ngay cả khi bạn dùng hệ thống số đếm chuẩn của tiếng Pháp."
"After it became apparent that many families were seeking legal help to fight the evictions, a meeting was held on March 20 at the East Bay Community Law Center for the victims of the housing scam.","Sau khi mà nhiều gia đình đang tìm kiếm sự hỗ trợ pháp lý để đấu tranh chống lại việc cưỡng chế, một cuộc họp đã được tổ chức vào ngày 20 tháng 3 tại Trung tâm Pháp lý Cộng đồng East Bay cho những người bị ảnh hưởng bởi vụ lừa đảo nhà ở."
The nucleus consists of two particles - neutrons and protons.,Hạt nhân nguyên tử gồm có hai loại hạt cơ bản là nơtron và prôton.
