Sentence,translated_text
"When the tenants started sharing what had occurred to them, most of the families involved suddenly realized that Carolyn Wilson of the OHA had stolen their security deposits, and skipped out of town.","Khi những người thuê nhà bắt đầu chia sẻ kinh nghiệm của họ, hầu hết các gia đình bị ảnh hưởng bất ngờ phát hiện rằng Carolyn Wilson thuộc OHA đã chiếm đoạt tiền ký quỹ an ninh của họ và bỏ trốn ra khỏi thị trấn."
"There is a surcharge for having more than 2 passengers, so this option might be more expensive than necessary.","Lưu ý có phụ thu nếu đi quá 2 hành khách, nên có thể tốn kém không cần thiết."
Surface tension happens because the water molecules at the surface of the water are strongly attracted to each other more than they are to the air molecules above them.,Độ căng bề mặt xảy ra vì lực hút giữa các phân tử nước ở bề mặt mạnh hơn so với không khí phía trên.
Present-day parts of Belgium were part of Luxembourg in the past but became Belgian after the 1830s Belgian Revolution.,"Các vùng của Bỉ ngày nay là một phần của Luxembourg trong lịch sử, nhưng trở thành một phần của Bỉ sau cuộc Cách mạng Bỉ những năm 1830."
"Thanks to undersea fiber optic cable links to Europe and broadband satellite, Greenland is well connected with 93% of the population having internet access.","Nhờ vào các liên kết cáp quang biển đến châu Âu và vệ tinh băng rộng, Greenland có kết nối tốt với 93% số dân có thể truy cập internet."
As the ability to obtain knowledge and to learn changed in such a way as mentioned above the base rate at which knowledge was obtained changed.,"Khi khả năng thu thập và lĩnh hội kiến thức thay đổi, tốc độ cơ bản thu thập kiến thức cũng thay đổi theo."
"And then back to the north through the west, once again crossing the Mara river, after the rains in around April.","Sau đó trở lại phía Bắc qua phía Tây, một lần nữa băng qua sông Mara, sau mùa mưa khoảng tháng Tư."
Sikhism is a religion from the Indian sub-continent. It originated in the Punjab region during the 15th century from a sectarian split within the Hindu tradition.,Đạo Sikh là một tôn giáo từ châu thổ Ấn Độ. Nó bắt nguồn từ vùng Punjab trong thế kỷ thứ 15 từ một sự phân chia giáo phái trong lòng truyền thống Hindu.
This is because electricity flowing into the socket where the metallic part of bulb sits can give you a severe electric shock if you touch the inside of the socket or the metal base of the bulb while it is still partly in the socket.,Điều này là do dòng điện chảy vào ổ cắm nơi phần kim loại của bóng đèn tiếp xúc có thể gây sốc điện mạnh cho bạn nếu bạn chạm vào phần bên trong của ổ cắm hoặc phần đế kim loại của bóng đèn trong khi bóng đèn vẫn còn một phần trong ổ cắm.
"Every year around October nearly 1.5 million herbivores travel towards the southern plains, crossing the Mara River, from the northern hills for the rains.","Mỗi năm vào khoảng tháng Mười, khoảng 1,5 triệu động vật ăn thực vật di chuyển từ vùng đồi phía bắc về phía đồng bằng phía nam, băng qua sông Mara, để tìm kiếm mùa mưa."
They normally offer higher bandwidth and better quality of service. They are encrypted and thus harder to spy on.,Nó thường cung cấp băng thông lớn hơn và chất lượng phục vụ tốt hơn. Vì được mã hóa nên chúng khó bị theo dõi hơn.
"Unlike other primates, hominids no longer use their hands in locomotion or bearing weight or swinging through the trees.","Khác với các loài linh trưởng khác, người cổ không còn dùng tay trong việc di chuyển, chịu trọng lượng hoặc nhảy qua cây."
"When people don't see moose as potentially dangerous, they may approach too closely and put themselves at risk.","Khi mọi người không coi nai sừng tấm là nguy hiểm, họ có thể lại quá gần và tự đặt mình vào nguy hiểm."
Authorities said little officially beyond confirming today's arrest.,Cơ quan chức năng không có bình luận chính thức gì nhiều ngoài việc xác nhận vụ bắt giữ hôm nay.
"The National Congress of Brazil has debated legalization for 10 years, and such civil marriages are currently only legal in Rio Grande do Sul.","Quốc hội Liên bang Brazil đã thảo luận về việc hợp pháp hóa trong 10 năm, và loại hình hôn nhân dân sự như vậy hiện chỉ được công nhận hợp pháp ở Rio Grande do Sul."
It can be better to use an agent who frequently books similar trips to yours.,Tốt nhất là làm việc với một đại lý thường xuyên tổ chức các chuyến đi giống như chuyến đi của bạn.
"While understanding one’s history does not assume understanding of culture, it does at least help people gain a sense of where they fall within the history of the organization.","Mặc dù hiểu biết về lịch sử của mình không đồng nghĩa với việc hiểu biết về văn hóa, nhưng nó giúp mọi người hiểu rõ hơn về vị trí của họ trong bối cảnh lịch sử của tổ chức."
Possible long term health events from excessive drinking can include liver damage and even blindness and death. The potential danger is increased when consuming illegally produced alcohol.,"Các biến chứng sức khỏe dài hạn có thể xảy ra do lạm dụng rượu có thể bao gồm bệnh gan và thậm chí mù lòa, tử vong. Rủi ro có thể xảy ra sẽ gia tăng khi sử dụng rượu lậu."
