Sentence,translated_text
"After it became apparent that many families were seeking legal help to fight the evictions, a meeting was held on March 20 at the East Bay Community Law Center for the victims of the housing scam.","Sau khi rõ ràng là nhiều gia đình đang tìm kiếm sự giúp đỡ pháp lý để chống lại việc trục xuất, một cuộc họp đã được tổ chức vào ngày 20 tháng Ba tại Trung tâm Luật Cộng đồng Vùng Vịnh Đông để giúp đỡ các nạn nhân của vụ lừa đảo bất động sản."
The nucleus consists of two particles - neutrons and protons.,Hạt nhân bao gồm hai loại hạt - nơtron và proton.
"When the tenants started sharing what had occurred to them, most of the families involved suddenly realized that Carolyn Wilson of the OHA had stolen their security deposits, and skipped out of town.","Khi các người thuê nhà bắt đầu chia sẻ những gì đã xảy ra với họ, hầu hết các gia đình liên quan đã đột nhiên nhận ra rằng Carolyn Wilson thuộc Cơ quan OHA đã đánh cắp tiền ký quỹ an ninh của họ và trốn khỏi thị trấn."
"There is a surcharge for having more than 2 passengers, so this option might be more expensive than necessary.","Có phụ phí cho việc có hơn 2 hành khách, vì vậy tùy chọn này có thể tốn kém hơn mức cần thiết."
Surface tension happens because the water molecules at the surface of the water are strongly attracted to each other more than they are to the air molecules above them.,"Áp suất bề mặt xảy ra vì các phân tử nước ở bề mặt nước bị thu hút mạnh mẽ với nhau nhiều hơn là, với các phân tử không khí ở trên chúng."
Present-day parts of Belgium were part of Luxembourg in the past but became Belgian after the 1830s Belgian Revolution.,Các phần hiện nay của Bỉ từng thuộc Luxembourg trong quá khứ nhưng trở thành một phần của Bỉ độc lập sau cuộc Cách mạng Bỉ (1830-1831).
"Thanks to undersea fiber optic cable links to Europe and broadband satellite, Greenland is well connected with 93% of the population having internet access.","Nhờ các liên kết cáp quang dưới biển đến châu Âu và vệ tinh băng thông rộng, Đảo Greenland được kết nối tốt với 93% dân số có quyền truy cập internet."
As the ability to obtain knowledge and to learn changed in such a way as mentioned above the base rate at which knowledge was obtained changed.,Khi khả năng thu thập kiến thức và học hỏi thay đổi như đã đề cập ở trên thì tỷ lệ cơ bản mà kiến thức được thu thập cũng thay đổi như đã đề cập ở trên.
"And then back to the north through the west, once again crossing the Mara river, after the rains in around April.","Và sau đó trở lại phía bắc qua phía tây, một lần nữa băng qua sông Mara, sau những cơn mưa vào khoảng tháng tư."
Sikhism is a religion from the Indian sub-continent. It originated in the Punjab region during the 15th century from a sectarian split within the Hindu tradition.,"Sikh giáo là một tôn giáo có nguồn gốc từ tiểu lục địa Ấn Độ. Nó bắt nguồn từ khu vực Punjab trong thế kỷ 15, từ một sự chia rẽ giáo phái trong truyền thống Hindu."
This is because electricity flowing into the socket where the metallic part of bulb sits can give you a severe electric shock if you touch the inside of the socket or the metal base of the bulb while it is still partly in the socket.,Điều này là vì dòng điện chảy vào ổ cắm nơi phần kim loại của bóng đèn đặt có thể gây sốc điện nghiêm trọng nếu bạn chạm vào bên trong ổ cắm hoặc đế kim loại của bóng đèn trong khi nó vẫn còn một phần trong ổ cắm.
"Every year around October nearly 1.5 million herbivores travel towards the southern plains, crossing the Mara River, from the northern hills for the rains.","Mỗi năm vào khoảng tháng Mười, gần 1,5 triệu loài động vật ăn cỏ di cư về phía đồng bằng phía nam, vượt qua sông Mara, từ vùng đồi phía bắc để tìm kiếm mùa mưa."
They normally offer higher bandwidth and better quality of service. They are encrypted and thus harder to spy on.,Họ thường cung cấp băng thông cao hơn và chất lượng dịch vụ tốt hơn. Chúng được mã hóa và do đó khó bị theo dõi hơn.
"Unlike other primates, hominids no longer use their hands in locomotion or bearing weight or swinging through the trees.","Không giống như các loài linh trưởng khác, hominid không còn dùng tay để di chuyển, chịu sức nặng hoặc đu qua cây cối nữa."
"When people don't see moose as potentially dangerous, they may approach too closely and put themselves at risk.","Khi mọi người không coi nai sừng tấm là nguy hiểm tiềm ẩn, họ có thể tiếp cận quá gần và đặt bản thân vào nguy hiểm."
Authorities said little officially beyond confirming today's arrest.,Cơ quan chức năng không cho biết nhiều thông tin chính thức ngoài việc xác nhận vụ bắt giữ ngày hôm nay.
"The National Congress of Brazil has debated legalization for 10 years, and such civil marriages are currently only legal in Rio Grande do Sul.","Quốc hội Brazil đã tranh luận về việc hợp pháp hóa trong 10 năm, và những cuộc hôn nhân dân sự như vậy hiện chỉ hợp pháp ở bang Rio Grande do Sul."
It can be better to use an agent who frequently books similar trips to yours.,Có thể tốt hơn khi sử dụng một đại lý thường xuyên đặt các chuyến đi tương tự như của bạn.
"While understanding one’s history does not assume understanding of culture, it does at least help people gain a sense of where they fall within the history of the organization.","Trong khi hiểu biết về lịch sử của một người không giả định sự hiểu biết về văn hóa, nó ít nhất giúp mọi người có được ý thức về vị trí của họ trong lịch sử của tổ chức."
Possible long term health events from excessive drinking can include liver damage and even blindness and death. The potential danger is increased when consuming illegally produced alcohol.,"Các biến chứng sức khỏe dài hạn có thể xảy ra do uống rượu quá mức bao gồm tổn thương gan, mù lòa và tử vong. Nguy cơ tiềm ẩn này sẽ tăng lên khi tiêu thụ rượu sản xuất bất hợp pháp."
