Sentence,translated_text
"Interactive design requires that components of a project connect to each other, but also make sense as a separate entity.","Thiết kế tương tác đòi hỏi các thành phần của một dự án phải kết nối với nhau, nhưng cũng phải có ý nghĩa như một thực thể riêng biệt."
Increasingly supermarkets are getting a more varied section of ready-made food. Some even provide a microwave oven or other means to heat food.,Các siêu thị ngày càng đa dạng về thực phẩm đã chế biến sẵn. Một số thậm chí còn cung cấp lò vi sóng hoặc các thiết bị làm nóng khác.
An official with the gas company was reporting to the scene after a neighbor called about a gas leak.,Một nhân viên của công ty khí đốt đã đến hiện trường sau khi nhận được cuộc gọi báo rò rỉ khí đốt từ một người hàng xóm.
"At least 100 people had attended the party, in order to celebrate the first anniversary of a couple whose wedding was held last year.","Ít nhất 100 người đã tham dự bữa tiệc, nhằm mục đích kỷ niệm ngày kỷ niệm một năm của một đôi vợ chồng đã tổ chức đám cưới vào năm ngoái."
"The Cook Islands are an island country in free association with New Zealand, located in Polynesia, in the middle of the South Pacific Ocean.","Quần đảo Cook là một quốc gia đảo có quan hệ tự do với New Zealand, nằm ở Polynesia, ở giữa Thái Bình Dương phía Nam."
"Cells are so basic and critical to the study of life, in fact, that they are often referred to as ""the building blocks of life"".","Tế bào là cơ bản và quan trọng nhất trong việc nghiên cứu sự sống con người, thực tế, chúng thường được gọi là 'các khối xây dựng của sự sống con người'."
Real-time text translator apps – applications that are capable of automatically translating whole segments of text from one language into another.,Ứng dụng dịch văn bản thời gian thực – các ứng dụng dịch văn bản thời gian thực có khả năng tự động dịch toàn bộ các đoạn văn bản từ một ngôn ngữ sang một ngôn ngữ khác.
"General John Cadwalder would launch a diversionary attack against the British garrison at Bordentown, in order to block off any reinforcements.","Tướng John Cadwalader sẽ phát động một cuộc tấn công đánh lạc hướng vào đồn trú của người Anh tại Bordentown, nhằm ngăn chặn bất kỳ lực lượng tăng援 nào."
The Drukgyal Dzong is a ruined fortress and Buddhist monastery in the upper part of the Paro District (in Phondey Village).,"Drukgyal Dzong là một pháo đài đổ nát và tu viện Phật giáo ở phần trên của quận Paro, thuộc làng Phondey."
Visa requirements and costs vary from nation to nation and are affected by the country you come from.,Yêu cầu và chi phí thị thực khác nhau tùy quốc gia và bị ảnh hưởng bởi quốc tịch của bạn.
"For most countries, you will need an offer letter from the institution you wish to study at, and also evidence of funds to support yourself for at least the first year of your course.","Đối với hầu hết các quốc gia khi du học, bạn sẽ cần một bức thư mời, từ trường đại học bạn muốn theo học và cũng cần bằng chứng về tài chính để hỗ trợ bản thân trong suốt năm học đầu tiên của khóa học."
"In this resonance, magnetic field and radio waves cause atoms to give off tiny radio signals.","Trong sự cộng hưởng này, từ trường và sóng vô tuyến khiến nguyên tử phát ra các tín hiệu vô tuyến nhỏ."
"Thus the scourges of Delhi Belly, the Pharaoh's Curse, Montezuma's Revenge, and their many friends.","Vậy là các chứng bệnh du lịch nổi tiếng của chứng Delhi Belly, lời nguyền của Pha-ra-ôn, sự báo thù của Montezuma, và các tên trộm của chúng."
"It has the same molecular structure whether it is a gas, liquid, or solid.","Nó có cấu trúc phân tử giống nhau dù ở thể khí, lỏng hay rắn."
A couple of thousand staff live here in summer in some four dozen bases mostly in those areas; a small number stay over winter.,"Vài nghìn nhân viên sống ở đây vào mùa hè trong khoảng bốn chục căn cứ, chủ yếu ở những khu vực đó; một số ít nhân viên ở lại qua mùa đông."
"The band's management company, HK Management Inc., gave no initial reason when they canceled on September 20, but blamed logistical reasons by the next day.","Công ty quản lý của ban nhạc HK Management Inc., đã hủy buổi biểu diễn vào ngày 20 tháng 9 mà không đưa ra lý do ban đầu, nhưng Tuy nhiên sau đó trích dẫn lý do hậu cần vào ngày tiếp theo."
"Although most agencies are willing to take on most regular bookings, many agents specialise in particular types of travel, budget ranges or destinations.","Mặc dù hầu hết các cơ quan đều sẵn sàng nhận hầu hết các đặt phòng thường xuyên, nhưng nhiều đại lý chuyên về các loại hình du lịch cụ thể, phạm vi ngân sách cụ thể hoặc điểm đến cụ thể."
Its large glazed windows and thin walls would not have been able to resist a determined attack for long.,Những cửa sổ lớn bằng kính và tường mỏng của nó sẽ không thể chống lại một cuộc tấn công quyết liệt trong thời gian dài.
However in 991 Ethelred was faced with a Viking fleet larger than any since Guthrum's a century earlier.,"Tuy nhiên, vào năm 991, Ethelred phải đối mặt với một hạm đội Viking lớn hơn bất kỳ hạm đội nào kể từ thời Guthrum một thế kỷ trước."
"According to reports, an apartment on Macbeth Street exploded due to a gas leak.","Theo báo cáo, một căn hộ trên đường Macbeth đã phát nổ do rò rỉ khí gas."
When all individuals in a population are identical with regard to a particular phenotypic trait they are known as monomorphic.,"Khi tất cả các cá thể trong một quần thể, giống hệt nhau về một đặc điểm kiểu hình cụ thể, chúng được gọi là đơn hình thái."
"The outer-part we see when we look at the Sun is called the photosphere, which means ""ball of light"".","Khi nhìn vào Mặt Trời, chúng ta thấy phần bên ngoài được gọi là quang cầu, có nghĩa là 'quả cầu' ánh sáng."
"The pattern should be deep enough, 5 mm (1/5 inch) or more, and the material soft enough in cold temperatures.","Họa tiết phải đủ sâu, 5 mm (1/5 inch) hoặc hơn, và vật liệu phải đủ mềm ở nhiệt độ lạnh."
"For those unfamiliar with medical jargon, the words infectious and contagious have distinct meanings.","Đối với những người không quen thuộc với thuật ngữ y tế, các từ nhiễm trùng và lây nhiễm có ý nghĩa riêng biệt."
"Avalanches are not an abnormality; steep slopes can hold only so much slow, and the excess volumes will come down as avalanches.","Lở tuyết không phải là một sự bất thường; sườn dốc chỉ có thể giữ được một lượng tuyết nhất định, và lượng tuyết thừa sẽ trượt xuống dưới dạng lở tuyết."
"These bosses had been reined in by Provenzano when he put an end to the Riina-driven war against the state that claimed the lives of Mafia crusaders Giovanni Falcone and Paolo Borsellino in 1992.""",Những ông chủ này đã bị Provenzano kiềm chế khi ông ấy chấm dứt cuộc chiến do Riina chống lại nhà nước đã cướp đi sinh mạng của những người đấu tranh chống Mafia là Giovanni Falcone và Paolo Borsellino vào năm 1992.
"Accompanied by those officials, he assured Texas citizens that steps were being taken to protect the public's safety.","Đi cùng với những quan chức đó, ông bảo đảm với công dân Texas rằng các biện pháp đang được thực hiện để bảo vệ an toàn công cộng."
The building housed a number of pilgrims who came to visit the holy city at the eve of hajj pilgrimage.,Tòa nhà này từng là nơi trú ngụ của một số lượng lớn những người hành hương đến thăm thành phố thánh vào đêm trước chuyến hành hương Hajj.
"Nevertheless, there are many distinctive ways of drinking coffee around the world that are worth experiencing.","Tuy nhiên, trên khắp thế giới có một số cách uống cà phê đặc trưng đáng để trải nghiệm."
"Already reporting in English and Japanese, the global organization is launching Spanish, Italian, and Korean-language programs, for television, the web, and mobile devices.","Đã có sẵn báo cáo tin tức bằng tiếng Anh và tiếng Nhật Bản, tổ chức toàn cầu đang phát sóng các chương trình truyền hình bằng tiếng Tây Ban Nha, tiếng Ý và tiếng Hàn, dành cho truyền hình, web và các thiết bị di động cầm tay."
A cell is the smallest structural and functional unit of a living (things) organism.,Một tế bào là đơn vị cấu trúc và chức năng nhỏ nhất của một sinh vật sống.
"During the last three decades, despite officially remaining a communist state, China has developed a market economy.","Trong ba thập kỷ qua, mặc dù chính thức vẫn là một quốc gia cộng sản, Trung Quốc đã phát triển một nền kinh tế thị trường."
"The focus of this mindset is speed, logic and accuracy, also identification of facts, reapplying existing techniques, gathering information.","Trọng tâm chính của tư duy này là tốc độ, logic và chính xác, đồng thời xác định sự thật, sử dụng lại kỹ thuật sẵn có và thu thập thông tin cần thiết."
"When low tide opened a gap along the Mystic River along the northeast of the peninsula, they quickly extended the fence with a short stone wall to the north ending at the water's edge on a small beach.","Khi thủy triều thấp mở một kẽ hở dọc theo sông Mystic ở phía đông bắc của bán đảo, họ nhanh chóng mở rộng hàng rào với một bức tường đá ngắn về phía bắc và kết thúc ở mép nước trên một bãi biển nhỏ."
"In this instance, recalling previous instances of entrepreneurial behavior and resulting successes helped people to be open to new changes and new direction for the local church.","Nhớ lại những trường hợp hành vi kinh doanh trước đây và những thành công đã giúp mọi người chấp nhận những thay đổi mới, cũng như hướng đi mới cho giáo xứ địa phương của họ."
"Jerusalem is the capital and largest city of Israel, though most other countries and the United Nations do not recognize it as Israel's capital.","Giê-ru-sa-lem là thủ đô và thành phố lớn nhất của Israel, mặc dù hầu hết các quốc gia khác và Liên Hợp Quốc không công nhận nó là thủ đô của Israel."
"Seven points behind, Johnson is second with 2,243.","Đứng thứ hai với 2.243 điểm, Johnson đang kém 7 điểm."
"""Apart from the fever and a sore throat, I feel well and in good shape to carry out my work by telecommuting.","Tôi trừ phi sốt và đau họng, tôi cảm thấy khá tốt và đủ sức khỏe để thực hiện công việc của mình qua hình thức làm việc từ xa."
"San Francisco has developed a large tourist infrastructure with numerous hotels, restaurants, and top-notch convention facilities.","Thành phố San Francisco đã phát triển một cơ sở hạ tầng du lịch lớn với vô số khách sạn, nhà hàng và cơ sở hội nghị hàng đầu."
"If you look at living things under a microscope, you will see that they are made of small squares or balls.","Nếu bạn nhìn các sinh vật dưới kính hiển vi, bạn có thể quan sát thấy chúng được cấu tạo từ những hình vuông nhỏ bé hoặc những hình cầu nhỏ."
"Written words are often easier to understand than spoken words, also. This is especially true of addresses, which are often difficult to pronounce intelligibly.","Từ viết thường dễ hiểu hơn từ nói, từ đó điều này đặc biệt đúng với địa chỉ, vì chúng thường khó phát âm một cách rõ ràng."
"Then, a few years later in 1639, an English astronomer named Jeremiah Horrocks observed a transit of Venus.","Sau đó, vài năm sau trong năm 1639, một nhà thiên văn học người Anh tên là Jeremiah Horrocks đã quan sát một lần sao Kim đi qua."
"Unless you are a diplomat, working overseas generally means that you will have to file income tax in the country you are based in.","Trừ khi bạn là một nhà ngoại giao, làm việc ở nước ngoài thường có nghĩa là bạn sẽ phải nộp thuế thu nhập ở quốc gia nơi bạn đang làm việc."
"However, Charles went to university at Trinity College, Cambridge where he studied Anthropology and Archaeology, and later History, earning a 2:2 (a lower second class degree).","Tuy nhiên, Charles đã theo học đại học tại Trinity College, Cambridge nơi ông đã học Nhân chủng học và Khảo cổ học, và sau đó là Lịch sử, tốt nghiệp với bằng cấp 2:2 (bằng cấp hạng hai thấp hơn)."
"I expect to return to all my duties on Monday,"" Arias said in a statement.","""Tôi hy vọng sẽ trở lại thực hiện tất cả nhiệm vụ của mình vào thứ Hai"", Arias cho biết như vậy trong một thông cáo báo chí."
"What is a cell? The word cell comes from the Latin word ""cella"", meaning ""small room"", and it was first coined by a microscopist observing the structure of cork.","Tế bào là gì? Từ tế bào bắt nguồn từ từ tiếng Latin ""cella"", có nghĩa là ""phòng nhỏ"", và nó được đặt ra lần đầu tiên bởi một nhà kính hiển vi quan sát cấu trúc của vỏ cây sồi."
Russian ground control activated the jets and normal attitude of the station was regained.,Bộ điều khiển mặt đất của Nga đã kích hoạt các động cơ phản lực và trạm đã lấy lại trạng thái bình thường.
"It is possible to secure park permits directly from the Ranger Station in Puerto Jiménez, but they do not accept credit cards",Có thể xin giấy phép vào công viên trực tiếp từ Trạm Cảnh sát Lâm nghiệp tại Puerto Jiménez nhưng không chấp nhận thẻ tín dụng.
"He did, however, reiterate his earlier statement that Roe v. Wade was the ""settled law of the land"", emphasizing the importance of consistent Supreme Court rulings.","Tuy nhiên, ông đã lặp lại tuyên bố trước đó của mình rằng Roe v. Wade là ""luật đất đã được thiết lập"", nhấn mạnh tầm quan trọng của các phán quyết nhất quán của Tòa án Tối cao."
"Especially in your initial days, consider splurging on Western-style and -quality hotels, food, and services to help acclimatize.","Đặc biệt là trong những ngày đầu tiên, hãy đầu tư vào khách sạn, ẩm thực và dịch vụ phương Tây để giúp bạn thích nghi."
"MRI is based on a physics phenomenon called nuclear magnetic resonance (NMR), which was discovered in the 1930s by Felix Bloch (working at Stanford University) and Edward Purcell (from Harvard University).","Chụp MRI dựa trên một hiện tượng vật lý gọi là cộng hưởng từ hạt nhân (NMR), được phát hiện vào những năm 1930 bởi Felix Bloch (làm việc tại Đại học Stanford) và Edward Purcell (từ Đại học Harvard)."
"In an ambush east of Bardia, the British captured the Italian Tenth Army's Engineer-in-Chief, General Lastucci.","Trong một cuộc phục kích ở phía đông Bardia, người Anh đã bắt được Tổng kỹ sư Tập đoàn quân số 10 của Ý, Tướng Lastucci."
"Wildlife is among the most challenging motifs for a photographer, and needs a combination of good luck, patience, experience and good equipment.","Động vật hoang dã là một trong những chủ đề khó khăn nhất đối với nhiếp ảnh gia, và cần sự kết hợp của may mắn, kiên nhẫn, kinh nghiệm và thiết bị tốt."
Today's Player of the Day is Alex Ovechkin of the Washington Capitals.,Cầu thủ xuất sắc nhất ngày hôm nay là Alex Ovechkin thuộc đội Washington Capitals hôm nay.
The jail became notorious after prisoner abuse was discovered there after US forces took over.,Trại giam trở nên nổi tiếng xấu sau khi lạm dụng tù nhân được phát hiện ở đó sau khi quân đội Mỹ tiếp quản.
"Born in the Croatian capital, Zagreb, Bobek gained fame while playing for Partizan Belgrade.","Sinh ra tại Zagreb, thủ đô Croatia, Bobek đã trở nên nổi tiếng khi thi đấu cho Partizan Belgrade."
"Around 11:29, the protest moved up Whitehall, past Trafalgar Square, along the Strand, passing by Aldwych and up Kingsway towards Holborn where the Conservative Party were holding their Spring Forum in the Grand Connaught Rooms hotel.","Vào khoảng 11:29, cuộc biểu tình di chuyển lên Whitehall, qua Quảng trường Trafalgar, dọc theo Strand, đi qua Aldwych và lên Kingsway hướng tới Holborn nơi Đảng Bảo thủ đang tổ chức Diễn đàn Mùa xuân tại khách sạn Grand Connaught Rooms."
"The Colonists, seeing this activity, had also called for reinforcements.","Những người định cư, chứng kiến hoạt động này, cũng đã kêu gọi tăng cường lực lượng."
Stark's men took positions along the fence on the north end of the Colonist's position.,Những người của Stark đã chiếm lấy vị trí dọc theo hàng rào ở đầu phía bắc của vị trí của người định cư.
It is an archipelago with 15 islands spread out over 2.2 million km2 of ocean.,"Đây là một quần đảo bao gồm 15 hòn đảo trải rộng trên 2,2 triệu ki-lô-mét vuông của đại dương."
"Peter Costello, Australian treasurer and the man most likely to succeed Prime Minister John Howard as Liberal party leader has thrown his support behind a nuclear power industry in Australia.","Peter Costello, bộ trưởng tài chính Úc và người có khả năng cao nhất sẽ kế vị thủ tướng John Howard làm lãnh đạo đảng Tự do Úc, đã tuyên bố ủng hộ ngành công nghiệp điện hạt nhân ở Úc."
"However, in Malaysia, at least among the Malays in rural areas, it means ""come over,"" similar to the index finger bent toward the body, a gesture which is used in certain Western countries, and should be used only for that purpose.","Tuy nhiên ở Malaysia, ít nhất là trong số người Mã Lai ở khu vực nông thôn, nó có nghĩa là ""đến đây"", tương tự như ngón tay trỏ cong về phía cơ thể, một cử chỉ được sử dụng ở một số quốc gia phương Tây như vậy và chỉ nên được sử dụng cho mục đích đó."
"If you are going to camp out, bring a camp cot or hammock to keep you away from snakes, scorpions and such.","Nếu bạn định cắm trại, hãy mang theo giường cắm trại hoặc võng để giữ bạn tránh xa rắn, bọ cạp và những thứ tương tự, để đảm bảo an toàn."
"The approach to obtaining information was different. No longer did pressure reside within individual recall, but the ability to recall text became more of a focus.","Cách tiếp cận để có được thông tin đã thay đổi. Không còn áp lực nằm trong việc nhớ lại của từng cá nhân, mà trọng tâm đã chuyển sang khả năng nhớ lại văn bản."
"Towering above the north end of Machu Picchu is this steep mountain, often the backdrop to many photos of the ruins.","Núi cao vút phía trên đầu phía bắc của Machu Picchu là ngọn núi dốc đứng này, thường là phía sau của nhiều bức ảnh về tàn tích."
A Triceratops could have used its strong beak to strip off the leaves before eating the trunk.,Một con Triceratops có thể đã sử dụng mỏ khỏe của nó để lột bỏ lá trước khi ăn thân cây.
It can be customized to make it easy to read and also with as much or little color as desired.,Nó có thể được tùy chỉnh để dễ đọc và cũng với nhiều hoặc ít màu như mong muốn.
"This authentic community is located in Howe Sound just off Vancouver, and is easily accessed via scheduled water taxis departing Granville Island in downtown Vancouver.","Cộng đồng đích thực này nằm ở Howe Sound, ngay bên ngoài Vancouver, và dễ dàng tiếp cận thông qua các chuyến taxi đường thủy theo lịch trình khởi hành từ đảo Granville ở trung tâm thành phố Vancouver."
"There were no heavy traffic delays reported on the beltway, the city's alternate route.","Không có báo cáo về tình trạng giao thông ùn tắc nghiêm trọng trên vành đai, tuyến đường thay thế của thành phố."
These requirements may often depend on what countries a traveller has visited or intends to visit.,Những yêu cầu này thường phụ thuộc vào quốc gia mà du khách đã đến thăm hoặc dự định đến thăm.
"The Il-76 has been a major component of both the Russian and Soviet military since the 1970s, and had already seen a serious accident in Russia last month.","Máy bay vận tải Il-76 đã là một thành phần chính của cả quân đội Nga và quân đội Liên Xô từ những năm 1970, và đã chứng kiến một vụ tai nạn nghiêm trọng ở Nga vào tháng trước."
"When the capsule gets to Earth and enters the atmosphere, at about 5am (eastern time), it is expected to put on quite a light show for folks in Northern California, Oregon, Nevada, and Utah.","Khi viên nang đó đến Trái Đất và đi vào bầu khí quyển, vào khoảng sáng sớm (giờ miền đông Hoa Kỳ), người ta dự đoán nó sẽ tạo ra một màn trình diễn ánh sáng rực rỡ cho người dân ở các bang Bắc California, Oregon, Nevada và Utah."
"Your hotel or hosts (if staying in a guesthouse or private home) will likely have wifi or an internet connected PC, and all settlements have an internet cafe or some location with public wifi.","Khách sạn hoặc chủ nhà (nếu ở nhà trọ hoặc nhà riêng) của bạn có khả năng cao có wifi hoặc máy tính có kết nối internet, và tất cả các khu dân cư đều có quán cà phê có internet hoặc cửa hàng internet, hoặc một số địa điểm có wifi miễn phí."
"One of the world's richest people, Allen has reportedly invested much of his wealth in marine exploration and began his quest to find the Musashi out of a lifelong interest in the war.","Một trong những người giàu có nhất thế giới này, Allen đã đầu tư phần lớn tài sản của mình vào việc nghiên cứu biển và bắt đầu cuộc tìm kiếm con tàu Musashi từ sự quan tâm suốt đời của ông về chiến tranh."
The main reason for this phenomenon is the result of the lucid dreams expanding the length of time between REM states.,Lý do chính cho hiện tượng này là kết quả của việc giấc mơ sáng tỏ mở rộng thời gian giữa các trạng thái REM.
"Because calls are routed over the Internet, you do not need to use a phone company located where you live or where you travel.","Bằng cách các cuộc gọi được định tuyến qua Internet, bạn không cần phải sử dụng một công ty viễn thông địa phương ở nơi bạn đang ở."
Each show would also provide recommendations for books that children should look for when they went to their library.,Mỗi chương trình cũng sẽ cung cấp các khuyến nghị về sách mà trẻ em nên tìm kiếm khi chúng đến thư viện.
Be sure the agent through whom you book is a Galapagos specialist with a good knowledge of a wide variety of ships.,"Trước khi đặt phòng, đảm bảo đại lý mà bạn đặt chỗ là một chuyên gia về Galapagos với kiến thức sâu rộng về nhiều tàu khác nhau."
"With fewer REMs per night, this state in which you experience actual sleep and your body recovers becomes infrequent enough to become a problem.","Khi có ít REM mỗi đêm, trạng thái bạn thực sự ngủ, và cơ thể bạn được phục hồi trở nên hiếm hoi đến mức trở thành một vấn đề."
"Nevertheless, all French-speaking Belgians and Swiss would have learned standard French in school, so they would be able to understand you even if you used the standard French numbering system.","Tuy nhiên, tất cả người Bỉ và người Thụy Sĩ nói tiếng Pháp đều đã học tiếng Pháp tiêu chuẩn ở trường, vì vậy họ sẽ có thể hiểu bạn ngay cả khi bạn sử dụng hệ thống số đếm tiếng Pháp tiêu chuẩn."
